{
  "description": "",
  "frameworks": [
    {
      "href": "https://atlas.mitre.org/tactics/AML.TA0007",
      "id": "AML.TA0007",
      "title": "MITRE ATLAS"
    },
    {
      "href": "https://attack.mitre.org/tactics/TA0005/",
      "id": "TA0005",
      "title": "MITRE ATT&CK"
    }
  ],
  "id": "tactics/defense_evasion",
  "summary": "The adversary is trying to avoid being detected by security software and native controls.",
  "tactic_order": 7,
  "title": "Defense Evasion"
}
