{
  "description": "",
  "frameworks": [
    {
      "href": "https://atlas.mitre.org/tactics/AML.TA0011",
      "id": "AML.TA0011",
      "title": "MITRE ATLAS"
    },
    {
      "href": "https://attack.mitre.org/tactics/TA0040/",
      "id": "TA0040",
      "title": "MITRE ATT&CK"
    }
  ],
  "id": "tactics/impact",
  "summary": "The adversary is trying to communicate with compromised systems to control them.",
  "tactic_order": 14,
  "title": "Impact"
}
